<foo xmlns:xsi="http://www.w3.org/2001/XMLSchema-instance" xsi:noNamespaceSchemaLocation="test.xsd">  <bar>xx</bar>  <bar>xx</bar>  <bar>xx</bar>  <bar>xx</bar>  <bar>xx</bar>  <bar>xx</bar>  <bar>xx</bar>  <bar>xx</bar>  <bar>xx</bar>  <bar>xx</bar></foo>